{
  "intent_id": "770e8400-e29b-41d4-a716-446655440020",
  "version": "0.1.0",
  "intent_text": "I need a low-latency LLM inference API for real-time code generation",
  "category": "agent",
  "constraints": {
    "max_latency_ms": 300,
    "region": ["us-east"],
    "compliance": ["SOC2"]
  },
  "preferences": {
    "ranking_profile": "latency_optimized",
    "max_results": 5,
    "include_federation": false
  },
  "metadata": {"source": "protocol-vector-test"},
  "created_at": "2024-01-15T10:00:00Z"
}
