{
  "intent_id": "660e8400-e29b-41d4-a716-446655440010",
  "version": "0.1.0",
  "intent_text": "I need a CRM integration service with SOC2 compliance for US operations",
  "category": "service",
  "constraints": {
    "region": ["us-east", "us-west"],
    "compliance": ["SOC2"],
    "availability_min": 0.999
  },
  "preferences": {
    "ranking_profile": "trust_optimized",
    "max_results": 5,
    "include_federation": false
  },
  "metadata": {"source": "protocol-vector-test"},
  "created_at": "2024-01-15T10:00:00Z"
}
